organisation,total_commits,total_pull_requests,contributors_count,contributors,repositories_count,repositories,years_active,first_contribution,last_contribution
vangheem,4650,782,1,vangheem,78,"Products.ATContentTypes, Products.Archetypes, Products.CMFEditions, Products.CMFPlone, Products.PlonePAS, Products.PortalTransforms, archetypes.referencebrowserwidget, buildout.coredev, documentation, guillotina, guillotina_dbusers, guillotina_elasticsearch, guillotina_gcloudstorage, guillotina_mailer, guillotina_prometheus, guillotina_rediscache, guillotina_s3storage, guillotina_statsd, mockup, planet.plone.org, plone.app.blob, plone.app.blocks, plone.app.caching, plone.app.collection, plone.app.content, plone.app.contentmenu, plone.app.contentrules, plone.app.contenttypes, plone.app.controlpanel, plone.app.dexterity, plone.app.discussion, plone.app.drafts, plone.app.event, plone.app.imaging, plone.app.iterate, plone.app.layout, plone.app.linkintegrity, plone.app.lockingbehavior, plone.app.mosaic, plone.app.multilingual, plone.app.portlets, plone.app.querystring, plone.app.registry, plone.app.relationfield, plone.app.robotframework, plone.app.standardtiles, plone.app.testing, plone.app.theming, plone.app.tiles, plone.app.upgrade, plone.app.users, plone.app.versioningbehavior, plone.app.vocabularies, plone.app.widgets, plone.app.z3cform, plone.cachepurging, plone.dexterity, plone.folder, plone.formwidget.namedfile, plone.formwidget.querystring, plone.formwidget.recurrence, plone.locking, plone.namedfile, plone.outputfilters, plone.portlet.collection, plone.portlet.static, plone.protect, plone.resource, plone.resourceeditor, plone.restapi, plone.schemaeditor, plone.staticresources, plone.subrequest, plone.theme, plone.tiles, plonetheme.barceloneta, training, volto","2015, 2016, 2017, 2018, 2019, 2020, 2021, 2022",2015-01-11,2022-05-15
syslab,3923,1464,5,"ale-rt, pilz, reinhardt, svx, thet",150,"Installers-UnifiedInstaller, Products.ATContentTypes, Products.Archetypes, Products.CMFDynamicViewFTI, Products.CMFEditions, Products.CMFFormController, Products.CMFPlacefulWorkflow, Products.CMFPlone, Products.CMFQuickInstallerTool, Products.LinguaPlone, Products.MimetypesRegistry, Products.PlonePAS, Products.PortalTransforms, Products.contentmigration, ansible.plone_server, archetypes.multilingual, archetypes.referencebrowserwidget, archetypes.schemaextender, archive.plone.org, bobtemplates.plone, borg.localrole, buildout.coredev, collective.indexing, collective.monkeypatcher, cookieplone-templates, docs-guide, documentation, five.intid, guillotina, jenkins.plone.org, meta, mockup, papyrus, pat-content-browser, planet.plone.org, plone-vs-snippets, plone.api, plone.app.blob, plone.app.blocks, plone.app.caching, plone.app.content, plone.app.contentlisting, plone.app.contentmenu, plone.app.contentrules, plone.app.contenttypes, plone.app.customerize, plone.app.debugtoolbar, plone.app.dexterity, plone.app.discussion, plone.app.event, plone.app.folder, plone.app.i18n, plone.app.imaging, plone.app.iterate, plone.app.layout, plone.app.ldap, plone.app.linkintegrity, plone.app.lockingbehavior, plone.app.mosaic, plone.app.multilingual, plone.app.multilingualindexes, plone.app.portlets, plone.app.querystring, plone.app.redirector, plone.app.registry, plone.app.relationfield, plone.app.robotframework, plone.app.standardtiles, plone.app.testing, plone.app.textfield, plone.app.theming, plone.app.tiles, plone.app.upgrade, plone.app.users, plone.app.uuid, plone.app.versioningbehavior, plone.app.viewletmanager, plone.app.vocabularies, plone.app.widgets, plone.app.workflow, plone.app.workflowmanager, plone.app.z3cform, plone.autoform, plone.autoinclude, plone.base, plone.batching, plone.behavior, plone.cachepurging, plone.caching, plone.classicui, plone.dexterity, plone.distribution, plone.docker, plone.event, plone.folder, plone.formwidget.autocomplete, plone.formwidget.contenttree, plone.formwidget.hcaptcha, plone.formwidget.multifile, plone.formwidget.namedfile, plone.formwidget.recaptcha, plone.formwidget.recurrence, plone.i18n, plone.indexer, plone.instanceprofiling, plone.jsonserializer, plone.keyring, plone.locking, plone.memoize, plone.namedfile, plone.outputfilters, plone.patternslib, plone.portlet.collection, plone.portlet.static, plone.portlets, plone.protect, plone.recipe.haproxy, plone.recipe.zeoserver, plone.recipe.zope2instance, plone.registry, plone.releaser, plone.reload, plone.resource, plone.resourceeditor, plone.rest, plone.restapi, plone.rfc822, plone.scale, plone.schemaeditor, plone.session, plone.staticresources, plone.stringinterp, plone.subrequest, plone.supermodel, plone.testing, plone.theme, plone.tiles, plone.transformchain, plone.uuid, plone.versioncheck, plone.volto, plone.z3cform, plonecli, ploneorg.core, ploneorg.theme, plonetheme.barceloneta, plonetheme.sunburst, sphinxtheme.plone, training, volto","2015, 2016, 2017, 2018, 2019, 2020, 2021, 2022, 2023, 2024",2015-01-04,2024-12-15
esteele,3470,27,1,esteele,134,"Plone, Products.ATContentTypes, Products.Archetypes, Products.CMFDiffTool, Products.CMFDynamicViewFTI, Products.CMFEditions, Products.CMFFormController, Products.CMFPlacefulWorkflow, Products.CMFPlone, Products.CMFQuickInstallerTool, Products.ExtendedPathIndex, Products.Marshall, Products.MimetypesRegistry, Products.PlacelessTranslationService, Products.PloneLanguageTool, Products.PlonePAS, Products.PortalTransforms, Products.ResourceRegistries, Products.contentmigration, Products.statusmessages, Products.validation, archetypes.multilingual, archetypes.referencebrowserwidget, archetypes.schemaextender, borg.localrole, buildout.coredev, collective.monkeypatcher, diazo, documentation, five.intid, guillotina, mockup, plone.api, plone.app.blob, plone.app.blocks, plone.app.caching, plone.app.collection, plone.app.content, plone.app.contentlisting, plone.app.contentmenu, plone.app.contentrules, plone.app.contenttypes, plone.app.controlpanel, plone.app.customerize, plone.app.debugtoolbar, plone.app.dexterity, plone.app.discussion, plone.app.drafts, plone.app.event, plone.app.folder, plone.app.i18n, plone.app.imaging, plone.app.intid, plone.app.iterate, plone.app.layout, plone.app.ldap, plone.app.linkintegrity, plone.app.lockingbehavior, plone.app.multilingual, plone.app.openid, plone.app.portlets, plone.app.querystring, plone.app.redirector, plone.app.referenceablebehavior, plone.app.registry, plone.app.relationfield, plone.app.robotframework, plone.app.testing, plone.app.textfield, plone.app.theming, plone.app.tiles, plone.app.upgrade, plone.app.users, plone.app.uuid, plone.app.versioningbehavior, plone.app.viewletmanager, plone.app.vocabularies, plone.app.widgets, plone.app.workflow, plone.app.z3cform, plone.autoform, plone.base, plone.batching, plone.browserlayer, plone.cachepurging, plone.dexterity, plone.event, plone.folder, plone.formwidget.autocomplete, plone.formwidget.datetime, plone.formwidget.namedfile, plone.formwidget.querystring, plone.formwidget.recurrence, plone.i18n, plone.indexer, plone.jsonserializer, plone.keyring, plone.locking, plone.login, plone.memoize, plone.namedfile, plone.openid, plone.outputfilters, plone.portlet.collection, plone.portlet.static, plone.protect, plone.recipe.zeoserver, plone.recipe.zope2instance, plone.registry, plone.releaser, plone.resource, plone.resourceeditor, plone.rest, plone.restapi, plone.rfc822, plone.scale, plone.schemaeditor, plone.session, plone.staticresources, plone.stringinterp, plone.subrequest, plone.supermodel, plone.testing, plone.theme, plone.tiles, plone.transformchain, plone.uuid, plone.versioncheck, plone.z3cform, ploneorg.core, ploneorg.theme, plonetheme.barceloneta, plonetheme.sunburst, volto","2015, 2016, 2017, 2018, 2019, 2020, 2021, 2022",2015-01-18,2022-11-27
starzel,3375,635,2,"pbauer, tlotze",136,"2023.ploneconf.org, Plone, Products.ATContentTypes, Products.Archetypes, Products.CMFDiffTool, Products.CMFDynamicViewFTI, Products.CMFEditions, Products.CMFFormController, Products.CMFPlacefulWorkflow, Products.CMFPlone, Products.CMFQuickInstallerTool, Products.LinguaPlone, Products.Marshall, Products.MimetypesRegistry, Products.PlacelessTranslationService, Products.PloneLanguageTool, Products.PlonePAS, Products.PortalTransforms, Products.ResourceRegistries, Products.contentmigration, Products.statusmessages, archetypes.referencebrowserwidget, archetypes.schemaextender, bobtemplates.plone, borg.localrole, buildout.coredev, collective.monkeypatcher, demo.plone.org, diazo, documentation, five.intid, jenkins.plone.org, mockup, old_plone.org, planet.plone.org, plone-backend, plone.api, plone.app.blob, plone.app.caching, plone.app.content, plone.app.contentlisting, plone.app.contentmenu, plone.app.contentrules, plone.app.contenttypes, plone.app.customerize, plone.app.debugtoolbar, plone.app.dexterity, plone.app.discussion, plone.app.drafts, plone.app.event, plone.app.folder, plone.app.i18n, plone.app.imaging, plone.app.intid, plone.app.iterate, plone.app.layout, plone.app.linkintegrity, plone.app.lockingbehavior, plone.app.multilingual, plone.app.portlets, plone.app.querystring, plone.app.referenceablebehavior, plone.app.registry, plone.app.relationfield, plone.app.robotframework, plone.app.standardtiles, plone.app.testing, plone.app.textfield, plone.app.theming, plone.app.upgrade, plone.app.users, plone.app.uuid, plone.app.versioningbehavior, plone.app.viewletmanager, plone.app.vocabularies, plone.app.vulnerabilities, plone.app.widgets, plone.app.workflow, plone.app.z3cform, plone.autoform, plone.base, plone.batching, plone.browserlayer, plone.cachepurging, plone.caching, plone.com-static, plone.contentrules, plone.dexterity, plone.distribution, plone.exportimport, plone.folder, plone.formwidget.namedfile, plone.formwidget.recurrence, plone.i18n, plone.indexer, plone.intelligenttext, plone.locking, plone.login, plone.namedfile, plone.nl, plone.org, plone.outputfilters, plone.patternslib, plone.portlet.collection, plone.portlet.static, plone.protect, plone.recipe.alltests, plone.recipe.zope2instance, plone.registry, plone.releaser, plone.reload, plone.resource, plone.resourceeditor, plone.rest, plone.restapi, plone.rfc822, plone.scale, plone.schemaeditor, plone.session, plone.staticresources, plone.stringinterp, plone.subrequest, plone.supermodel, plone.testing, plone.theme, plone.tiles, plone.transformchain, plone.volto, plone.z3cform, ploneconf.org, ploneorg.core, plonetheme.barceloneta, quickstart, training, volto, zodbverify","2015, 2016, 2017, 2018, 2019, 2020, 2021, 2022, 2023, 2024",2015-01-04,2024-12-15
stevepiercy,2901,767,1,stevepiercy,35,".github, Plone, Products.CMFPlone, ansible-playbook, ansible.plone_server, buildout.coredev, cookieplone, cookieplone-templates, demo.plone.org, documentation, helm-charts, meta, mockup, mr.roboto, plone-backend, plone-sphinx-theme, plone-vs-snippets, plone.api, plone.app.caching, plone.app.theming, plone.base, plone.distribution, plone.org, plone.recipe.zope2instance, plone.rest, plone.restapi, plone.volto, ploneorg.theme, plonetheme.barceloneta, pylons-project-assimilation, sphinxtheme.plone, training, volto, volto-quanta-project, volto-reference-backend","2016, 2017, 2018, 2019, 2020, 2021, 2022, 2023, 2024",2016-11-06,2024-12-29
kombinat,2647,663,1,petschki,80,"Products.Archetypes, Products.CMFDiffTool, Products.CMFEditions, Products.CMFFormController, Products.CMFPlone, Products.MimetypesRegistry, Products.PortalTransforms, archetypes.schemaextender, bobtemplates.plone, buildout.coredev, collective.monkeypatcher, diazo, documentation, jenkins.plone.org, meta, mockup, mr.roboto, plone.app.blocks, plone.app.caching, plone.app.content, plone.app.contentmenu, plone.app.contentrules, plone.app.contenttypes, plone.app.debugtoolbar, plone.app.dexterity, plone.app.discussion, plone.app.drafts, plone.app.event, plone.app.folder, plone.app.layout, plone.app.mosaic, plone.app.multilingual, plone.app.portlets, plone.app.querystring, plone.app.registry, plone.app.relationfield, plone.app.robotframework, plone.app.standardtiles, plone.app.testing, plone.app.textfield, plone.app.theming, plone.app.tiles, plone.app.upgrade, plone.app.users, plone.app.versioningbehavior, plone.app.viewletmanager, plone.app.widgets, plone.app.workflow, plone.app.z3cform, plone.autoform, plone.base, plone.batching, plone.dexterity, plone.folder, plone.formwidget.hcaptcha, plone.formwidget.querystring, plone.formwidget.recaptcha, plone.formwidget.recurrence, plone.jsonserializer, plone.keyring, plone.locking, plone.namedfile, plone.outputfilters, plone.patternslib, plone.portlet.collection, plone.portlet.static, plone.protect, plone.recipe.haproxy, plone.recipe.zeoserver, plone.recipe.zope2instance, plone.resourceeditor, plone.restapi, plone.schemaeditor, plone.staticresources, plone.testing, plone.theme, plone.versioncheck, plone.volto, plone.z3cform, plonetheme.barceloneta","2015, 2016, 2017, 2018, 2019, 2020, 2021, 2022, 2023, 2024",2015-01-04,2024-12-22
nuclia,1924,765,3,"bloodbare, ebrehault, mpellerin42",67,"Products.ATContentTypes, Products.Archetypes, Products.CMFDiffTool, Products.CMFPlone, Products.PlonePAS, ansible-playbook, archetypes.multilingual, buildout.coredev, diazo, documentation, executioner, guillotina, guillotina-volto, guillotina_dbusers, guillotina_elasticsearch, guillotina_gcloudstorage, guillotina_mailer, guillotina_prometheus, guillotina_rediscache, guillotina_s3storage, mockup, mr.roboto, pastanaga-angular, planet.plone.org, plone.alterego, plone.api, plone.app.caching, plone.app.content, plone.app.contentmenu, plone.app.contenttypes, plone.app.controlpanel, plone.app.dexterity, plone.app.discussion, plone.app.i18n, plone.app.layout, plone.app.linkintegrity, plone.app.mosaic, plone.app.multilingual, plone.app.portlets, plone.app.querystring, plone.app.registry, plone.app.relationfield, plone.app.standardtiles, plone.app.testing, plone.app.theming, plone.app.upgrade, plone.app.users, plone.app.versioningbehavior, plone.app.vocabularies, plone.app.widgets, plone.app.workflowmanager, plone.docker, plone.i18n, plone.jenkins_server, plone.jsonserializer, plone.org, plone.registry, plone.resource, plone.resourceeditor, plone.rest, plone.restapi, plone.restapi-angular, plone.schemaeditor, plone.theme, plonetheme.barceloneta, training, volto","2015, 2016, 2017, 2018, 2019, 2020, 2021, 2022, 2023, 2024",2015-01-04,2024-11-03
derico,1920,218,1,MrTango,52,"Products.CMFPlone, Products.PortalTransforms, ansible.plone_server, bobtemplates.plone, buildout.coredev, classic-ui-team, documentation, mockup, papyrus, pat-content-browser, plone-vs-snippets, plone.api, plone.app.blocks, plone.app.contentrules, plone.app.contenttypes, plone.app.dexterity, plone.app.discussion, plone.app.layout, plone.app.ldap, plone.app.mosaic, plone.app.multilingual, plone.app.portlets, plone.app.querystring, plone.app.registry, plone.app.robotframework, plone.app.standardtiles, plone.app.testing, plone.app.theming, plone.app.tiles, plone.app.upgrade, plone.app.users, plone.app.widgets, plone.app.z3cform, plone.autoinclude, plone.base, plone.classicui, plone.docker, plone.gallery, plone.namedfile, plone.outputfilters, plone.pdfexport, plone.resourceeditor, plone.restapi, plone.scale, plone.schema, plone.staticresources, plone.subrequest, plone.typesense, plonecli, plonetheme.barceloneta, training, volto","2015, 2016, 2017, 2018, 2019, 2020, 2021, 2022, 2023, 2024",2015-01-18,2024-11-17
university-jyvaskylä,1424,177,1,datakurre,47,"Products.CMFPlone, Products.statusmessages, buildout.coredev, documentation, guillotina, mockup, papyrus, planet.plone.org, plone.alterego, plone.app.blocks, plone.app.content, plone.app.contentrules, plone.app.contenttypes, plone.app.controlpanel, plone.app.drafts, plone.app.mosaic, plone.app.multilingual, plone.app.portlets, plone.app.querystring, plone.app.registry, plone.app.robotframework, plone.app.standardtiles, plone.app.textfield, plone.app.theming, plone.app.tiles, plone.app.upgrade, plone.app.versioningbehavior, plone.app.workflow, plone.app.z3cform, plone.autoform, plone.dexterity, plone.formwidget.namedfile, plone.jsonserializer, plone.namedfile, plone.protect, plone.recipe.codeanalysis, plone.schemaeditor, plone.subrequest, plone.supermodel, plone.synchronize, plone.testing, plone.themepreview, plone.tiles, plone.uuid, plonetheme.barceloneta, training, volto","2015, 2016, 2017, 2018, 2019, 2020, 2021, 2022, 2023",2015-01-18,2023-06-25
eau-de-web,1306,645,8,"Petchesi-Iulian, ana-oprea, avoinea, claudiaifrim, dobri1408, ichim-david, nileshgulia1, tiberiuichim",45,"Products.CMFEditions, Products.CMFPlone, buildout.coredev, critical-css-cli, documentation, mockup, pastanaga-icons, planet.plone.org, plone-backend, plone-haproxy, plone.api, plone.app.caching, plone.app.collection, plone.app.contenttypes, plone.app.dexterity, plone.app.discussion, plone.app.event, plone.app.imaging, plone.app.iterate, plone.app.layout, plone.app.multilingual, plone.app.portlets, plone.app.redirector, plone.app.relationfield, plone.app.upgrade, plone.app.users, plone.app.versioningbehavior, plone.app.widgets, plone.cachepurging, plone.dexterity, plone.docker, plone.namedfile, plone.portlet.collection, plone.recipe.zope2instance, plone.rest, plone.restapi, plone.schema, plone.schemaeditor, plone.stringinterp, plone.volto, plonetheme.barceloneta, training, volto, volto-addon-ci, volto-quanta","2015, 2016, 2017, 2018, 2019, 2020, 2021, 2022, 2023, 2024",2015-04-12,2024-12-15
rohberg,1219,292,1,ksuess,31,"Plone, Products.CMFPlacefulWorkflow, Products.CMFPlone, buildout.coredev, cookieplone-templates, demo.plone.org, documentation, guillotina, mockup, plone.api, plone.app.blocks, plone.app.caching, plone.app.content, plone.app.contentmenu, plone.app.dexterity, plone.app.discussion, plone.app.linkintegrity, plone.app.robotframework, plone.app.standardtiles, plone.app.testing, plone.app.upgrade, plone.app.vocabularies, plone.app.z3cform, plone.exportimport, plone.formwidget.hcaptcha, plone.i18n, plone.restapi, plone.schema, plone.volto, training, volto","2017, 2018, 2019, 2020, 2021, 2022, 2023, 2024",2017-07-16,2024-12-22
agitator,1074,239,1,agitator,52,"Products.Archetypes, Products.CMFEditions, Products.CMFPlacefulWorkflow, Products.CMFPlone, bobtemplates.plone, buildout.coredev, documentation, mockup, plone.app.blocks, plone.app.caching, plone.app.content, plone.app.contentmenu, plone.app.contentrules, plone.app.contenttypes, plone.app.dexterity, plone.app.discussion, plone.app.event, plone.app.layout, plone.app.mosaic, plone.app.multilingual, plone.app.portlets, plone.app.querystring, plone.app.registry, plone.app.robotframework, plone.app.standardtiles, plone.app.textfield, plone.app.theming, plone.app.tiles, plone.app.upgrade, plone.app.users, plone.app.widgets, plone.app.workflow, plone.app.z3cform, plone.base, plone.batching, plone.dexterity, plone.formwidget.autocomplete, plone.formwidget.multifile, plone.formwidget.namedfile, plone.i18n, plone.jsonserializer, plone.login, plone.outputfilters, plone.portlet.collection, plone.portlet.static, plone.rest, plone.restapi, plone.staticresources, plone.subrequest, plone.z3cform, plonetheme.barceloneta, training","2015, 2016, 2017, 2018, 2019, 2020, 2021, 2022, 2023",2015-01-11,2023-01-22
redturtle,790,547,8,"Wagner3UB, cekk, folix-01, giuliaghisini, mamico, nzambello, pnicolli, yurj",52,"Products.CMFFormController, Products.CMFPlone, Products.PortalTransforms, blocks-conversion-tool, bobtemplates.plone, buildout.coredev, cookieplone-templates, documentation, mockup, plone-backend, plone-frontend, plone-zeo, plone.app.caching, plone.app.content, plone.app.contentlisting, plone.app.contentmenu, plone.app.contenttypes, plone.app.dexterity, plone.app.discussion, plone.app.event, plone.app.layout, plone.app.multilingual, plone.app.portlets, plone.app.querystring, plone.app.standardtiles, plone.app.theming, plone.app.tiles, plone.app.users, plone.app.z3cform, plone.dexterity, plone.distribution, plone.docker, plone.event, plone.formwidget.contenttree, plone.formwidget.datetime, plone.formwidget.hcaptcha, plone.formwidget.namedfile, plone.formwidget.recaptcha, plone.namedfile, plone.org, plone.patternslib, plone.recipe.zeoserver, plone.recipe.zope2instance, plone.rest, plone.restapi, plone.scale, plone.staticresources, plone.volto, ploneorg.theme, plonetheme.barceloneta, training, volto","2015, 2017, 2018, 2019, 2020, 2021, 2022, 2023, 2024",2015-03-22,2024-12-29
codesyntax,746,402,3,"erral, ionlizarazu, libargutxi",51,"2023.ploneconf.org, Products.CMFDiffTool, Products.CMFPlone, Products.LinguaPlone, Products.validation, bobtemplates.plone, buildout.coredev, cookieplone, cookieplone-templates, documentation, jenkins.plone.org, mockup, plone-backend, plone-vs-snippets, plone.app.caching, plone.app.content, plone.app.contentlisting, plone.app.contentrules, plone.app.contenttypes, plone.app.dexterity, plone.app.discussion, plone.app.event, plone.app.iterate, plone.app.layout, plone.app.linkintegrity, plone.app.multilingual, plone.app.portlets, plone.app.querystring, plone.app.registry, plone.app.theming, plone.app.upgrade, plone.app.users, plone.app.versioningbehavior, plone.app.viewletmanager, plone.dexterity, plone.distribution, plone.formwidget.hcaptcha, plone.formwidget.recaptcha, plone.i18n, plone.nl, plone.recipe.haproxy, plone.recipe.zope2instance, plone.rest, plone.restapi, plone.staticresources, plone.volto, plone.z3cform, plonecli, plonetheme.barceloneta, training, volto","2015, 2016, 2017, 2018, 2019, 2020, 2021, 2022, 2023, 2024",2015-09-06,2024-12-29
tkimnguyen,514,148,1,tkimnguyen,41,"2023.ploneconf.org, 2024.ploneconf.org, Installers-UnifiedInstaller, Plone, Products.CMFPlone, ansible-playbook, ansible.plone_server, archetypes.referencebrowserwidget, bobtemplates.plone, buildout.coredev, diazo, documentation, guillotina, mockup, planet.plone.org, plone-backend, plone.api, plone.app.dexterity, plone.app.layout, plone.app.ldap, plone.app.mosaic, plone.app.theming, plone.app.viewletmanager, plone.app.workflowmanager, plone.com-static, plone.dexterity, plone.docker, plone.formwidget.namedfile, plone.namedfile, plone.nl, plone.protect, plone.restapi, ploneconf.org, ploneconf2016.policy, plonedev.vagrant, ploneorg.core, ploneorg.theme, plonetheme.barceloneta, pylons-project-assimilation, sphinxtheme.plone, training","2015, 2016, 2017, 2018, 2019, 2020, 2021, 2022, 2023, 2024",2015-02-22,2024-12-29
4teamwork,345,143,6,"buchi, deiferni, elioschmutz, jone, lukasgraf, phgross",12,"collective.indexing, plone.app.relationfield, plone.app.robotframework, plone.app.textfield, plone.dexterity, plone.formwidget.contenttree, plone.formwidget.datetime, plone.namedfile, plone.protect, plone.rest, plone.restapi, plone.supermodel","2015, 2016, 2017, 2018, 2019, 2020, 2021",2015-05-24,2021-05-02
imio,343,132,3,"bsuttor, gbastien, gotcha",61,"2023.ploneconf.org, Products.ATContentTypes, Products.Archetypes, Products.CMFDynamicViewFTI, Products.CMFPlone, Products.LinguaPlone, Products.MimetypesRegistry, Products.PortalTransforms, Products.contentmigration, Products.validation, archetypes.multilingual, archetypes.referencebrowserwidget, bobtemplates.plone, buildout.coredev, code-quality, guillotina, jenkins.plone.org, meta, planet.plone.org, plone.api, plone.app.blocks, plone.app.contentlisting, plone.app.contentrules, plone.app.contenttypes, plone.app.dexterity, plone.app.discussion, plone.app.event, plone.app.form, plone.app.iterate, plone.app.layout, plone.app.multilingual, plone.app.relationfield, plone.app.robotframework, plone.app.standardtiles, plone.app.testing, plone.app.textfield, plone.app.themingplugins, plone.app.upgrade, plone.app.users, plone.app.vocabularies, plone.app.z3cform, plone.batching, plone.cachepurging, plone.dexterity, plone.docker, plone.formwidget.datetime, plone.formwidget.querystring, plone.htmx, plone.multilingualbehavior, plone.namedfile, plone.nl, plone.outputfilters, plone.recipe.zeoserver, plone.recipe.zope2instance, plone.restapi, plone.scale, plone.schemaeditor, plone.testing, ploneconf.org, training, volto","2015, 2016, 2017, 2018, 2019, 2020, 2021, 2022, 2023, 2024",2015-01-04,2024-10-20
university-hospital-dresden,298,85,1,1letter,31,"Products.CMFPlacefulWorkflow, Products.CMFPlone, Products.ResourceRegistries, bobtemplates.plone, buildout.coredev, documentation, meta, mockup, plone.app.content, plone.app.contentmenu, plone.app.contentrules, plone.app.contenttypes, plone.app.dexterity, plone.app.discussion, plone.app.event, plone.app.i18n, plone.app.layout, plone.app.mosaic, plone.app.multilingual, plone.app.portlets, plone.app.registry, plone.app.upgrade, plone.app.users, plone.app.widgets, plone.base, plone.i18n, plone.portlet.collection, plone.restapi, plone.schemaeditor, plone.staticresources, plonetheme.barceloneta","2019, 2020, 2021, 2022, 2023, 2024",2019-07-21,2024-12-15
iskra,264,179,3,"masipcat, nilbacardit26, rboixaderg",7,"guillotina, guillotina_elasticsearch, guillotina_prometheus, guillotina_rediscache, guillotina_s3storage, pastanaga-angular, volto","2018, 2019, 2020, 2021, 2022, 2023, 2024",2018-01-07,2024-10-20
tschorr,261,61,1,tschorr,23,"Products.Archetypes, Products.CMFEditions, Products.CMFPlone, Products.CMFQuickInstallerTool, Products.PlonePAS, Products.isurlinportal, buildout.coredev, documentation, helm-charts, plone.api, plone.app.contentlisting, plone.app.discussion, plone.app.linkintegrity, plone.app.testing, plone.autoinclude, plone.protect, plone.recipe.zeoserver, plone.recipe.zope2instance, plone.rest, plone.restapi, plonetheme.barceloneta, training, volto","2015, 2016, 2017, 2018, 2019, 2020, 2021, 2022, 2023, 2024",2015-09-06,2024-04-21
