organisation,total_commits,total_pull_requests,contributors_count,contributors,repositories_count,repositories,years_active,first_contribution,last_contribution
frapell,252,111,1,frapell,37,"Products.CMFDiffTool, Products.CMFPlone, buildout.coredev, collective.monkeypatcher, guillotina, guillotina-volto, mockup, plone.app.blob, plone.app.content, plone.app.contenttypes, plone.app.dexterity, plone.app.event, plone.app.iterate, plone.app.mosaic, plone.app.portlets, plone.app.querystring, plone.app.standardtiles, plone.app.theming, plone.app.upgrade, plone.app.widgets, plone.app.workflow, plone.app.z3cform, plone.base, plone.dexterity, plone.folder, plone.formwidget.hcaptcha, plone.formwidget.recaptcha, plone.formwidget.recurrence, plone.memoize, plone.patternslib, plone.recipe.zope2instance, plone.rest, plone.schemaeditor, plone.staticresources, plonetheme.barceloneta, training, volto","2015, 2016, 2017, 2018, 2019, 2020, 2021, 2022, 2023, 2024",2015-01-11,2024-03-03
polyester,193,93,1,polyester,28,"Installers-UnifiedInstaller, Plone, Products.CMFPlone, ansible-playbook, archive.plone.org, bobtemplates.plone, buildout.coredev, documentation, papyrus, planet.plone.org, plone.api, plone.app.contenttypes, plone.app.dexterity, plone.app.event, plone.app.layout, plone.app.portlets, plone.app.robotframework, plone.app.testing, plone.app.theming, plone.rest, plone.restapi, plone.testing, ploneorg.core, ploneorg.theme, plonetheme.barceloneta, pylons-project-assimilation, sphinxtheme.plone, training","2015, 2016, 2017, 2018, 2019, 2020, 2021, 2022, 2023, 2024",2015-04-26,2024-11-24
pretaweb,169,148,4,"JeffersonBledsoe, djay, djowett, instification",34,"Products.CMFPlone, Products.LinguaPlone, ansible-playbook, ansible.plone_server, archetypes.multilingual, bobtemplates.plone, buildout.coredev, documentation, helm-charts, plone.app.async, plone.app.caching, plone.app.collection, plone.app.contentlisting, plone.app.contentrules, plone.app.contenttypes, plone.app.customerize, plone.app.debugtoolbar, plone.app.discussion, plone.app.iterate, plone.app.layout, plone.app.multilingual, plone.app.querystring, plone.app.standardtiles, plone.app.theming, plone.app.vulnerabilities, plone.autoform, plone.locking, plone.namedfile, plone.rest, plone.restapi, plone.supermodel, plonetheme.barceloneta, training, volto","2015, 2016, 2017, 2018, 2019, 2020, 2021, 2022, 2023, 2024",2015-03-08,2024-12-01
serpro,164,157,1,wesleybl,25,"Products.CMFEditions, Products.CMFPlone, bobtemplates.plone, buildout.coredev, code-quality, meta, plone-frontend, plone.app.contenttypes, plone.app.discussion, plone.app.iterate, plone.app.robotframework, plone.app.testing, plone.app.versioningbehavior, plone.dexterity, plone.dotfiles, plone.formwidget.recaptcha, plone.rest, plone.restapi, plone.scale, plone.schemaeditor, plone.volto, plonecli, training, volto, volto-addon-ci","2020, 2021, 2022, 2023, 2024",2020-10-25,2024-12-15
it-spirit,156,26,1,thomasmassmann,17,"Products.CMFPlone, Products.PortalTransforms, bobtemplates.plone, buildout.coredev, documentation, mockup, plone.app.layout, plone.app.standardtiles, plone.app.theming, plone.app.upgrade, plone.app.users, plone.recipe.codeanalysis, plone.resourceeditor, plone.restapi, plonecli, plonetheme.barceloneta, training","2015, 2017, 2018, 2019, 2020, 2021, 2022",2015-07-12,2022-01-09
affinitic,136,67,2,"laulaz, mpeeters",35,"2023.ploneconf.org, Products.CMFPlone, archetypes.multilingual, bobtemplates.plone, buildout.coredev, diazo, documentation, mockup, pastanaga, plone.api, plone.app.caching, plone.app.content, plone.app.contenttypes, plone.app.dexterity, plone.app.event, plone.app.layout, plone.app.mosaic, plone.app.multilingual, plone.app.theming, plone.app.versioningbehavior, plone.app.z3cform, plone.base, plone.behavior, plone.formwidget.autocomplete, plone.formwidget.datetime, plone.formwidget.multifile, plone.gallery, plone.nl, plone.org, plone.patternslib, plone.recipe.zope2instance, plone.restapi, ploneconf.org, training, volto","2015, 2016, 2017, 2018, 2019, 2020, 2021, 2022, 2023, 2024",2015-07-19,2024-10-06
dbain,90,20,1,pigeonflight,12,"Products.CMFPlone, ansible-playbook, bobtemplates.plone, documentation, planet.plone.org, plone.app.registry, plone.docker, plone.rest, plonecli, plonetheme.barceloneta, training, volto","2015, 2016, 2017, 2018, 2019, 2020, 2021, 2024",2015-03-01,2021-11-21
rohnsha0,87,21,1,rohnsha0,10,"Plone, Products.CMFPlone, buildout.coredev, plone.app.contentmenu, plone.app.theming, plone.app.vocabularies, plone.restapi, plone.volto, ploneorg.theme, sphinxtheme.plone","2022, 2024",2022-08-07,2024-10-13
dataflake,74,18,1,dataflake,3,"buildout.coredev, meta, plone.recipe.zope2instance","2019, 2020, 2021",2019-04-14,2021-10-31
iham,69,45,1,iham,27,"Products.Archetypes, Products.CMFDynamicViewFTI, Products.CMFEditions, Products.CMFPlone, bobtemplates.plone, buildout.coredev, plone.app.caching, plone.app.contentmenu, plone.app.contenttypes, plone.app.dexterity, plone.app.discussion, plone.app.event, plone.app.iterate, plone.app.layout, plone.app.mosaic, plone.app.multilingual, plone.app.registry, plone.app.relationfield, plone.app.upgrade, plone.app.versioningbehavior, plone.app.widgets, plone.app.workflowmanager, plone.app.z3cform, plone.batching, plone.recipe.codeanalysis, plone.supermodel, plonetheme.barceloneta","2016, 2018, 2019, 2020, 2021, 2022",2016-03-06,2022-09-11
academy-of-fine-arts-vienna,58,21,1,gogobd,11,"Products.Archetypes, buildout.coredev, cookiecutter-zope-instance, plone.api, plone.app.mosaic, plone.app.multilingual, plone.app.multilingualindexes, plone.app.querystring, plone.event, plone.instanceprofiling, plone.resource","2017, 2018, 2019, 2020, 2021, 2023, 2024",2017-01-29,2024-02-18
zopyx,51,17,1,zopyx,18,"Products.CMFPlone, Products.MimetypesRegistry, Products.PlonePAS, bobtemplates.plone, buildout.coredev, planet.plone.org, plone.api, plone.app.content, plone.app.dexterity, plone.app.layout, plone.app.portlets, plone.outputfilters, plone.recipe.zeoserver, plone.recipe.zope2instance, plone.rest, plone.restapi, plone.schemaeditor, training","2015, 2016, 2017, 2018, 2019, 2020, 2021, 2022, 2023",2015-04-05,2023-10-08
rpatterson,49,30,1,rpatterson,17,"Products.CMFPlone, Products.PlonePAS, Products.contentmigration, buildout.coredev, mr.roboto, plone.app.contenttypes, plone.app.imaging, plone.app.iterate, plone.app.portlets, plone.app.referenceablebehavior, plone.app.testing, plone.app.widgets, plone.app.z3cform, plone.rest, plone.restapi, plone.volto, volto","2018, 2019, 2020, 2021, 2022",2018-11-11,2022-03-06
zest,44,6,1,jladage,7,"plone.app.event, plone.app.layout, plone.app.multilingual, plone.app.upgrade, plone.base, plone.docker, plone.formwidget.namedfile","2015, 2016, 2017, 2024",2015-11-08,2024-03-31
ku-leuven,37,12,1,spereverde,10,"Products.PloneTestCase, documentation, plone.app.blob, plone.app.dexterity, plone.app.iterate, plone.app.standardtiles, plone.dotfiles, quickstart, training, volto","2018, 2019, 2020, 2021, 2022, 2023, 2024",2018-12-09,2024-02-18
macagua,36,15,1,macagua,7,"planet.plone.org, plone.app.blob, plone.app.debugtoolbar, plone.app.discussion, plone.restapi, training, volto","2015, 2016, 2017, 2018, 2019, 2021, 2022, 2023, 2024",2015-05-31,2024-02-18
cms-com,35,39,1,terapyon,17,"Installers-UnifiedInstaller, Products.CMFDiffTool, Products.CMFPlone, buildout.coredev, documentation, guillotina, mockup, plone.app.content, plone.app.dexterity, plone.app.discussion, plone.app.event, plone.app.imaging, plone.app.multilingual, plone.app.theming, plone.i18n, plone.restapi, volto","2015, 2016, 2017, 2018, 2019, 2020, 2021, 2022",2015-04-26,2022-11-06
radio-free-asia,25,12,1,flipmcf,10,"2023.ploneconf.org, documentation, mockup, plone.app.dexterity, plone.app.vocabularies, plone.formwidget.namedfile, plone.nl, plone.outputfilters, ploneconf.org, training","2018, 2019, 2020, 2021, 2022",2019-10-27,2021-12-05
cosent,15,14,1,gyst,9,"Products.CMFPlone, buildout.coredev, collective.indexing, plone.api, plone.app.event, plone.app.theming, plone.recipe.codeanalysis, plone.recipe.zope2instance, plonetheme.barceloneta","2015, 2016, 2018, 2024",2015-05-31,2024-05-05
university-tu-dresden,14,18,1,pgrunewald,10,"Products.Archetypes, Products.MimetypesRegistry, buildout.coredev, documentation, plone.app.linkintegrity, plone.formwidget.contenttree, plone.memoize, plone.outputfilters, plone.staticresources, volto","2016, 2017, 2019, 2020, 2022, 2023, 2024",2017-04-16,2024-05-12
abstract,14,17,2,"gianniftp, szakitibi",12,"Products.CMFPlone, documentation, plone.app.contentmenu, plone.app.contenttypes, plone.app.layout, plone.app.multilingual, plone.app.registry, plone.app.z3cform, plone.batching, plone.registry, plone.staticresources, volto","2021, 2023, 2024",2023-10-01,2024-05-19
witsch,14,11,1,witsch,6,"archetypes.multilingual, archetypes.querywidget, plone.app.multilingual, plone.portlet.collection, plone.restapi, plone.testing","2017, 2018, 2019, 2020, 2021, 2023",2017-02-26,2020-08-30
interaktiv,9,7,1,mliebischer,5,"cookiecutter-zope-instance, plone.app.contenttypes, plone.app.multilingual, plone.namedfile, training","2020, 2021, 2022, 2023",2021-02-07,2023-08-20
nelen-schuurmans,8,2,1,reinout,1,meta,2024,2024-01-28,2024-02-04
fhnw,3,5,2,"adrianschulz, tomschall",3,"cookieplone-templates, plone.de, volto",2024,2024-04-21,2024-07-21
minddistrict,0,48,1,icemac,19,"Products.Archetypes, Products.CMFPlacefulWorkflow, Products.CMFPlone, Products.PloneHotfix20210518, buildout.coredev, collective.monkeypatcher, diazo, documentation, plone.app.contentrules, plone.app.portlets, plone.app.testing, plone.app.workflow, plone.memoize, plone.protect, plone.recipe.zeoserver, plone.recipe.zope2instance, plone.testing, plone.z3cform, zodbverify","2015, 2016, 2017, 2018, 2019, 2020, 2021, 2022",,
