organisation,total_commits,total_pull_requests,contributors_count,contributors,repositories_count,repositories,first_contribution,last_contribution
PY76,2527,195,1,mauritsvanrees,137,"Plone, Products.ATContentTypes, Products.Archetypes, Products.CMFDiffTool, Products.CMFDynamicViewFTI, Products.CMFEditions, Products.CMFFormController, Products.CMFPlacefulWorkflow, Products.CMFPlone, Products.CMFQuickInstallerTool, Products.ExtendedPathIndex, Products.LinguaPlone, Products.Marshall, Products.MimetypesRegistry, Products.PlacelessTranslationService, Products.PloneLanguageTool, Products.PlonePAS, Products.PortalTransforms, Products.ResourceRegistries, Products.contentmigration, Products.statusmessages, Products.validation, archetypes.multilingual, archetypes.querywidget, archetypes.referencebrowserwidget, archetypes.schemaextender, bobtemplates.plone, borg.localrole, buildout.coredev, diazo, documentation, experimental.publishtraverse, five.intid, jenkins.plone.org, mockup, mr.roboto, papyrus, plone.alterego, plone.api, plone.app.blob, plone.app.caching, plone.app.collection, plone.app.content, plone.app.contentlisting, plone.app.contentmenu, plone.app.contentrules, plone.app.contenttypes, plone.app.controlpanel, plone.app.customerize, plone.app.debugtoolbar, plone.app.dexterity, plone.app.discussion, plone.app.event, plone.app.folder, plone.app.i18n, plone.app.imaging, plone.app.intid, plone.app.iterate, plone.app.layout, plone.app.ldap, plone.app.linkintegrity, plone.app.lockingbehavior, plone.app.mosaic, plone.app.multilingual, plone.app.openid, plone.app.portlets, plone.app.querystring, plone.app.redirector, plone.app.referenceablebehavior, plone.app.registry, plone.app.relationfield, plone.app.robotframework, plone.app.search, plone.app.testing, plone.app.textfield, plone.app.theming, plone.app.upgrade, plone.app.users, plone.app.uuid, plone.app.versioningbehavior, plone.app.viewletmanager, plone.app.vocabularies, plone.app.widgets, plone.app.workflow, plone.app.z3cform, plone.autoform, plone.batching, plone.behavior, plone.browserlayer, plone.cachepurging, plone.caching, plone.contentrules, plone.dexterity, plone.event, plone.folder, plone.formwidget.autocomplete, plone.formwidget.contenttree, plone.formwidget.datetime, plone.formwidget.namedfile, plone.formwidget.querystring, plone.formwidget.recurrence, plone.i18n, plone.indexer, plone.intelligenttext, plone.keyring, plone.locking, plone.memoize, plone.namedfile, plone.openid, plone.outputfilters, plone.portlet.collection, plone.portlets, plone.protect, plone.recipe.zeoserver, plone.recipe.zope2instance, plone.registry, plone.releaser, plone.reload, plone.resource, plone.resourceeditor, plone.rfc822, plone.scale, plone.schema, plone.session, plone.stringinterp, plone.subrequest, plone.supermodel, plone.synchronize, plone.testing, plone.theme, plone.tiles, plone.transformchain, plone.uuid, plone.versioncheck, plone.z3cform, plonetheme.barceloneta, plonetheme.sunburst",2016-01-03,2016-12-25
der Freitag,1196,258,1,gforcada,128,"Plone, Products.ATContentTypes, Products.Archetypes, Products.CMFDiffTool, Products.CMFEditions, Products.CMFFormController, Products.CMFPlacefulWorkflow, Products.CMFPlone, Products.ExtendedPathIndex, Products.LinguaPlone, Products.Marshall, Products.MimetypesRegistry, Products.PlacelessTranslationService, Products.PloneLanguageTool, Products.PlonePAS, Products.ResourceRegistries, Products.contentmigration, Products.statusmessages, Products.validation, ansible-playbook, archetypes.multilingual, archetypes.referencebrowserwidget, archetypes.schemaextender, bobtemplates.plone, borg.localrole, buildout.coredev, collective.monkeypatcher, documentation, guillotina, jenkins.plone.org, mockup, mr.roboto, plone.alterego, plone.api, plone.app.blob, plone.app.blocks, plone.app.caching, plone.app.collection, plone.app.content, plone.app.contentlisting, plone.app.contentmenu, plone.app.contentrules, plone.app.contenttypes, plone.app.customerize, plone.app.debugtoolbar, plone.app.dexterity, plone.app.discussion, plone.app.drafts, plone.app.event, plone.app.folder, plone.app.i18n, plone.app.imaging, plone.app.intid, plone.app.iterate, plone.app.layout, plone.app.ldap, plone.app.linkintegrity, plone.app.lockingbehavior, plone.app.mosaic, plone.app.multilingual, plone.app.openid, plone.app.portlets, plone.app.querystring, plone.app.redirector, plone.app.referenceablebehavior, plone.app.registry, plone.app.standardtiles, plone.app.testing, plone.app.textfield, plone.app.theming, plone.app.tiles, plone.app.upgrade, plone.app.users, plone.app.uuid, plone.app.versioningbehavior, plone.app.viewletmanager, plone.app.vocabularies, plone.app.widgets, plone.app.workflow, plone.autoform, plone.batching, plone.behavior, plone.cachepurging, plone.caching, plone.contentrules, plone.dexterity, plone.event, plone.folder, plone.formwidget.autocomplete, plone.formwidget.contenttree, plone.formwidget.datetime, plone.formwidget.multifile, plone.formwidget.namedfile, plone.formwidget.querystring, plone.formwidget.recurrence, plone.i18n, plone.indexer, plone.jenkins_node, plone.jenkins_server, plone.keyring, plone.locking, plone.memoize, plone.namedfile, plone.outputfilters, plone.portlet.collection, plone.portlets, plone.protect, plone.recipe.codeanalysis, plone.recipe.zope2instance, plone.registry, plone.releaser, plone.reload, plone.resource, plone.resourceeditor, plone.restapi, plone.rfc822, plone.scale, plone.schemaeditor, plone.stringinterp, plone.testing, plone.theme, plone.tiles, plone.uuid, plone.versioncheck, ploneorg.core, plonetheme.barceloneta, plonetheme.sunburst, training",2016-01-03,2016-12-25
Klein & Partner KG,1015,167,1,jensens,73,"Plone, Products.ATContentTypes, Products.Archetypes, Products.CMFEditions, Products.CMFPlone, Products.CMFQuickInstallerTool, Products.MimetypesRegistry, Products.PortalTransforms, Products.statusmessages, Products.validation, archetypes.multilingual, bobtemplates.plone, buildout.coredev, documentation, five.intid, plone.alterego, plone.app.blob, plone.app.blocks, plone.app.caching, plone.app.collection, plone.app.content, plone.app.contentlisting, plone.app.contentmenu, plone.app.contenttypes, plone.app.dexterity, plone.app.drafts, plone.app.event, plone.app.imaging, plone.app.intid, plone.app.iterate, plone.app.layout, plone.app.lockingbehavior, plone.app.mosaic, plone.app.multilingual, plone.app.multilingualindexes, plone.app.portlets, plone.app.querystring, plone.app.registry, plone.app.relationfield, plone.app.standardtiles, plone.app.tiles, plone.app.upgrade, plone.app.versioningbehavior, plone.app.viewletmanager, plone.app.vocabularies, plone.app.z3cform, plone.autoform, plone.behavior, plone.cachepurging, plone.caching, plone.contentrules, plone.dexterity, plone.github, plone.i18n, plone.namedfile, plone.outputfilters, plone.patternslib, plone.portlets, plone.protect, plone.recipe.zope2instance, plone.registry, plone.resource, plone.rfc822, plone.scale, plone.schemaeditor, plone.session, plone.subrequest, plone.supermodel, plone.tiles, plone.transformchain, plone.versioncheck, plone.z3cform, ploneorg.core",2016-01-03,2016-12-25
Independent,944,393,82,"AnneGilles, AuroreMariscal, DieKatze, Gagaro, RobZoneNet, SyZn, aclark4life, acsr, albertduran, alecpm, allcaps, andreesg, brunobbbs, calvinhp, casdr, cedricmessiant, cewing, cleberjsantos, danmur, davidjb, davilima6, dbitouze, deankarlen, demarant, displacedaussie, dmunicio, do3cc, fgrcon, fhelmberger, fhnwba, geier, ghost, gvizdyk, huubbouma, hvelarde, ida, ivanteoh, janga1997, jcbrand, jean, jianaijun, jochumdev, jpgimenez, julianhandl, karalics, keul, khanstark, krissik, l34marr, lccruz, lukebrannon, macagua, malthe, martior, metatoaster, neilferreira, obct537, oz123, petri, pigeonflight, prakharjoshi, pysailor, rafaelbco, ramiroluz, reyha, rnixx, rodfersou, rosehosting, rristow, seanupton, sebasgo, serge73, skleinfeldt, staeff, stefanfoulis, tmog, tschorr, vangheem, vikas-parashar, vipod, witekdev, zmijunkie",95,"Products.Archetypes, Products.CMFDiffTool, Products.CMFEditions, Products.CMFPlone, Products.LinguaPlone, Products.PlonePAS, Products.PortalTransforms, Products.ResourceRegistries, ansible-playbook, ansible.plone_server, archetypes.querywidget, archetypes.referencebrowserwidget, bobtemplates.plone, buildout.coredev, diazo, documentation, guillotina, guillotina_dbusers, guillotina_elasticsearch, guillotina_mailer, jenkins.plone.org, mockup, planet.plone.org, plone.api, plone.app.blob, plone.app.blocks, plone.app.caching, plone.app.content, plone.app.contentlisting, plone.app.contentmenu, plone.app.contentrules, plone.app.contenttypes, plone.app.controlpanel, plone.app.customerize, plone.app.dexterity, plone.app.discussion, plone.app.drafts, plone.app.event, plone.app.i18n, plone.app.iterate, plone.app.layout, plone.app.ldap, plone.app.linkintegrity, plone.app.mosaic, plone.app.multilingual, plone.app.portlets, plone.app.querystring, plone.app.referenceablebehavior, plone.app.registry, plone.app.relationfield, plone.app.robotframework, plone.app.search, plone.app.standardtiles, plone.app.testing, plone.app.theming, plone.app.tiles, plone.app.upgrade, plone.app.users, plone.app.versioningbehavior, plone.app.vocabularies, plone.app.widgets, plone.app.z3cform, plone.batching, plone.caching, plone.dexterity, plone.docker, plone.formwidget.autocomplete, plone.formwidget.contenttree, plone.formwidget.datetime, plone.formwidget.namedfile, plone.formwidget.recaptcha, plone.formwidget.recurrence, plone.i18n, plone.namedfile, plone.outputfilters, plone.patternslib, plone.portlet.collection, plone.portlet.static, plone.protect, plone.recipe.zope2instance, plone.releaser, plone.resource, plone.restapi, plone.scale, plone.schemaeditor, plone.stringinterp, plone.testing, plone.tiles, plone.versioncheck, ploneconf2016.policy, ploneorg.core, ploneorg.theme, plonetheme.barceloneta, sphinxtheme.plone, training",2016-01-03,2016-12-25
Syslab,683,262,3,"ale-rt, svx, thet",76,"Installers-UnifiedInstaller, Products.Archetypes, Products.CMFPlone, Products.LinguaPlone, Products.contentmigration, ansible.plone_server, archetypes.referencebrowserwidget, archetypes.schemaextender, bobtemplates.plone, buildout.coredev, documentation, five.intid, mockup, papyrus, plone.api, plone.app.blocks, plone.app.caching, plone.app.content, plone.app.contentmenu, plone.app.contentrules, plone.app.contenttypes, plone.app.customerize, plone.app.debugtoolbar, plone.app.dexterity, plone.app.discussion, plone.app.event, plone.app.folder, plone.app.i18n, plone.app.imaging, plone.app.layout, plone.app.linkintegrity, plone.app.lockingbehavior, plone.app.mosaic, plone.app.multilingual, plone.app.portlets, plone.app.registry, plone.app.robotframework, plone.app.standardtiles, plone.app.testing, plone.app.theming, plone.app.tiles, plone.app.upgrade, plone.app.versioningbehavior, plone.app.vocabularies, plone.app.widgets, plone.app.z3cform, plone.autoform, plone.batching, plone.behavior, plone.dexterity, plone.docker, plone.formwidget.multifile, plone.formwidget.namedfile, plone.formwidget.recurrence, plone.indexer, plone.memoize, plone.namedfile, plone.outputfilters, plone.patternslib, plone.portlet.static, plone.recipe.zeoserver, plone.registry, plone.releaser, plone.resource, plone.rfc822, plone.scale, plone.supermodel, plone.testing, plone.tiles, plone.versioncheck, plone.z3cform, ploneorg.core, plonetheme.barceloneta, plonetheme.sunburst, sphinxtheme.plone, training",2016-01-03,2016-12-18
University of Jyväskylä,400,50,1,datakurre,23,"Products.CMFPlone, buildout.coredev, guillotina, mockup, plone.alterego, plone.app.blocks, plone.app.content, plone.app.controlpanel, plone.app.drafts, plone.app.mosaic, plone.app.portlets, plone.app.registry, plone.app.robotframework, plone.app.standardtiles, plone.app.theming, plone.app.tiles, plone.app.workflow, plone.recipe.codeanalysis, plone.synchronize, plone.testing, plone.tiles, plone.uuid, plonetheme.barceloneta",2016-01-10,2016-12-25
Nuclia,390,31,2,"bloodbare, ebrehault",23,"Products.CMFPlone, buildout.coredev, documentation, guillotina, guillotina_elasticsearch, guillotina_gcloudstorage, guillotina_s3storage, mockup, plone.alterego, plone.api, plone.app.contenttypes, plone.app.mosaic, plone.app.testing, plone.app.theming, plone.app.users, plone.app.vocabularies, plone.docker, plone.registry, plone.resource, plone.resourceeditor, plone.restapi, plonetheme.barceloneta, training",2016-01-10,2016-12-18
Salesforce,346,0,1,esteele,52,"Plone, Products.ATContentTypes, Products.CMFDiffTool, Products.CMFEditions, Products.CMFPlone, Products.ExtendedPathIndex, Products.PlonePAS, Products.PortalTransforms, Products.contentmigration, buildout.coredev, five.intid, guillotina, mockup, plone.app.blob, plone.app.caching, plone.app.content, plone.app.contenttypes, plone.app.controlpanel, plone.app.discussion, plone.app.event, plone.app.intid, plone.app.iterate, plone.app.layout, plone.app.ldap, plone.app.linkintegrity, plone.app.multilingual, plone.app.portlets, plone.app.querystring, plone.app.registry, plone.app.relationfield, plone.app.testing, plone.app.theming, plone.app.upgrade, plone.app.users, plone.app.versioningbehavior, plone.app.vocabularies, plone.app.widgets, plone.autoform, plone.formwidget.autocomplete, plone.i18n, plone.outputfilters, plone.protect, plone.recipe.zope2instance, plone.registry, plone.resourceeditor, plone.supermodel, plone.transformchain, plone.uuid, ploneorg.core, ploneorg.theme, plonetheme.barceloneta, plonetheme.sunburst",2016-01-03,2016-10-16
kitconcept GmbH,321,58,6,"davisagli, fredvd, jaroel, robgietema, sneridagh, tisto",43,"Plone, Products.ATContentTypes, Products.Archetypes, Products.CMFDiffTool, Products.CMFEditions, Products.CMFFormController, Products.CMFPlone, Products.contentmigration, ansible-playbook, bobtemplates.plone, buildout.coredev, documentation, guillotina, jenkins.plone.org, mockup, plone.alterego, plone.api, plone.app.content, plone.app.contentmenu, plone.app.contenttypes, plone.app.discussion, plone.app.event, plone.app.imaging, plone.app.linkintegrity, plone.app.multilingual, plone.app.theming, plone.app.vocabularies, plone.app.vulnerabilities, plone.app.z3cform, plone.batching, plone.behavior, plone.dexterity, plone.event, plone.formwidget.recaptcha, plone.portlets, plone.recipe.codeanalysis, plone.rest, plone.restapi, plone.synchronize, ploneorg.core, ploneorg.theme, training, volto",2016-01-24,2016-12-25
Starzel,228,28,3,"Gomez, pbauer, tlotze",33,"Products.ATContentTypes, Products.Archetypes, Products.CMFDiffTool, Products.CMFEditions, Products.CMFFormController, Products.CMFPlone, Products.CMFQuickInstallerTool, Products.PlacelessTranslationService, Products.PloneLanguageTool, Products.PlonePAS, Products.PortalTransforms, Products.ResourceRegistries, Products.contentmigration, ansible.plone_server, archetypes.schemaextender, bobtemplates.plone, buildout.coredev, documentation, plone.api, plone.app.contentmenu, plone.app.contenttypes, plone.app.customerize, plone.app.lockingbehavior, plone.app.referenceablebehavior, plone.app.theming, plone.app.upgrade, plone.app.users, plone.app.z3cform, plone.i18n, plone.recipe.zope2instance, plone.stringinterp, plone.supermodel, training",2016-01-03,2016-10-23
Reid-McMahon,194,25,1,smcmahon,8,"Installers-UnifiedInstaller, ansible-playbook, ansible.plone_server, buildout.coredev, plone.app.dexterity, plone.namedfile, plonedev.vagrant, training",2016-01-10,2016-11-20
4Teamwork,133,52,4,"buchi, elioschmutz, jone, lukasgraf",4,"plone.dexterity, plone.formwidget.contenttree, plone.rest, plone.restapi",2016-01-03,2016-12-04
Agitator,104,18,1,agitator,13,"Products.CMFPlone, buildout.coredev, plone.app.blocks, plone.app.contenttypes, plone.app.mosaic, plone.app.multilingual, plone.app.multilingualindexes, plone.app.portlets, plone.app.standardtiles, plone.app.upgrade, plone.formwidget.autocomplete, plonetheme.barceloneta, training",2016-01-17,2016-12-18
FHNW,93,28,1,tomgross,21,"Products.ATContentTypes, Products.CMFEditions, Products.CMFPlone, Products.PortalTransforms, Products.ResourceRegistries, buildout.coredev, plone.app.contenttypes, plone.app.discussion, plone.app.linkintegrity, plone.app.portlets, plone.app.standardtiles, plone.app.upgrade, plone.app.z3cform, plone.formwidget.multifile, plone.memoize, plone.namedfile, plone.outputfilters, plone.registry, plone.rest, plone.tiles, training",2016-01-10,2016-12-18
Sixfeetup,87,18,1,tkimnguyen,13,"Products.CMFPlone, buildout.coredev, documentation, planet.plone.org, plone.api, plone.app.dexterity, plone.app.layout, plone.app.mosaic, ploneconf2016.policy, ploneorg.core, ploneorg.theme, sphinxtheme.plone, training",2016-01-31,2016-12-18
Ecréall,48,0,1,vincentfretin,8,"Products.CMFPlone, buildout.coredev, plone.app.contentmenu, plone.app.portlets, plone.app.search, plone.app.vocabularies, plone.formwidget.contenttree, plone.formwidget.datetime",2016-01-24,2016-11-20
CCC,47,16,1,polyester,9,"bobtemplates.plone, buildout.coredev, documentation, papyrus, plone.app.robotframework, plone.restapi, ploneorg.core, ploneorg.theme, sphinxtheme.plone",2016-04-03,2016-11-20
Eau de Web,45,10,2,"avoinea, ichim-david",4,"buildout.coredev, plone.app.collection, plone.docker, plone.stringinterp",2016-01-31,2016-10-09
iMio,44,25,5,"bsuttor, gbastien, gotcha, sgeulette, sverbois",16,"Products.LinguaPlone, Products.contentmigration, buildout.coredev, documentation, plone.api, plone.app.contenttypes, plone.app.dexterity, plone.app.event, plone.app.form, plone.app.iterate, plone.app.layout, plone.app.multilingual, plone.app.robotframework, plone.app.vocabularies, plone.app.z3cform, plone.formwidget.querystring",2016-02-07,2016-11-27
Pretaweb,36,25,1,djowett,7,"Products.LinguaPlone, ansible-playbook, ansible.plone_server, plone.app.layout, plone.app.multilingual, plone.locking, training",2016-02-21,2016-12-25
Derico,30,4,1,MrTango,7,"Products.CMFPlone, ansible.plone_server, bobtemplates.plone, buildout.coredev, documentation, plone.app.multilingual, training",2016-02-14,2016-10-23
Jarn,23,3,3,"MatthewWilkes, hannosch, lrowe",6,"Products.CMFPlone, Products.ExtendedPathIndex, Products.PlonePAS, buildout.coredev, diazo, plone.app.contentmenu",2016-08-14,2016-10-23
Ludwig Maximilian University Munich,19,5,1,loechel,6,"buildout.coredev, plone.app.content, plone.app.dexterity, plone.namedfile, plone.versioncheck, ploneorg.theme",2016-01-24,2016-12-18
Steve Piercy - Website Builder,16,3,1,stevepiercy,1,training,2016-11-06,2016-11-13
Soliton Consulting,12,3,1,fulv,5,"Products.CMFPlone, ansible-playbook, plone.scale, ploneorg.core, training",2016-01-10,2016-09-04
Codesyntax,11,3,1,erral,2,"Products.LinguaPlone, plone.restapi",2016-02-28,2016-11-06
Affinitic,10,4,2,"laulaz, mpeeters",6,"bobtemplates.plone, buildout.coredev, documentation, plone.app.caching, plone.behavior, plone.formwidget.datetime",2016-01-03,2016-09-25
Enfold,7,2,1,frapell,3,"Products.CMFDiffTool, buildout.coredev, plone.app.event",2016-02-21,2016-09-11
CMS Communications Inc.,6,7,1,terapyon,5,"Installers-UnifiedInstaller, Products.CMFPlone, documentation, mockup, plone.app.content",2016-02-14,2016-05-29
Kombinat,5,6,1,petschki,4,"mockup, plone.app.content, plone.app.widgets, plone.z3cform",2016-04-10,2016-11-06
Cosent,3,4,1,gyst,3,"Products.CMFPlone, buildout.coredev, plonetheme.barceloneta",2016-02-21,2016-09-25
Academy of FA Vienna,3,8,1,iham,7,"Products.CMFEditions, Products.CMFPlone, buildout.coredev, plone.app.iterate, plone.app.multilingual, plone.app.workflowmanager, plone.supermodel",2016-03-06,2016-05-22
Webmeisterei,0,1,1,frisi,1,plone.app.theming,,
minddistrict,0,6,1,icemac,4,"buildout.coredev, documentation, plone.app.testing, plone.testing",,
TU Dresden,0,2,1,pgrunewald,2,"documentation, plone.outputfilters",,
